"Title","Subtitle","CELEX number","Current consolidated version","Latest consolidated version","LP_Legal basis","ELI","Form","EUROVOC descriptor","ECLI identifier","Subject matter","Directory code","Case-Law directory code (before Lisbon)","Case-Law directory code (after Lisbon)","Legal basis","Transposed legal act(s)","Rectified by","Type of procedure","Collection of the document","Date of document","Date of publication","Author","Date of effect","Date of end of validity","Date of transposition","Applicant/Appellant","Defendant/Other parties to the proceedings","In force indicator","Publication Reference",
"Information from the Commission - Appointment of a new member of the Committee of Experts on the Transit of Electricity between Grids set up under Commission Decision 92/167/EEC (Text with EEA relevance)","","31999Y0917(02)","","","","","Communication","electrical energy, transit, self-employed person, energy transport, committee (EU)","","Energy, Provisions governing the Institutions","Energy, General principles and programmes","","","","","","","ALL_ALL, PUBLISHED_IN_OJ, EU_LAW_ALL, LEGISLATION","1999-09-13","1999-09-17","European Commission","1999-09-13","No end date","","","","true","OJ C 263, 17/09/1999, p. 3–3
		 (ES, DA, DE, EL, EN, FR, IT, NL, PT, FI, SV)",
"Notice concerning the applications of nuclear energy","","31972Y1201(03)","","","","","Communication","Joint Research Centre, research programme, nuclear energy, disclosure of information","","Energy, Nuclear common market","Energy, Nuclear energy, Nuclear research","","","","","","","ALL_ALL, PUBLISHED_IN_OJ, EU_LAW_ALL, LEGISLATION","1972-12-01","1972-12-01, 1972-01-01, 1986-01-01","European Commission","1972-12-01","No end date","","","","true","OJ C 125, 01/12/1972, p. 16–16
		 (DE, FR, IT, NL), English special edition: Series I Volume 1972(1-8.12) P. 31  - 31, Other special edition(s) (
           		DA, ES, PT)
		",
