"Title","Subtitle","CELEX number","Current consolidated version","Latest consolidated version","LP_Legal basis","ELI","Form","EUROVOC descriptor","ECLI identifier","Subject matter","Directory code","Case-Law directory code (before Lisbon)","Case-Law directory code (after Lisbon)","Legal basis","Transposed legal act(s)","Rectified by","Type of procedure","Collection of the document","Date of document","Date of publication","Author","Date of effect","Date of end of validity","Date of transposition","Applicant/Appellant","Defendant/Other parties to the proceedings","In force indicator","Publication Reference",
"Protocol on Claims, Legal Proceedings and Indemnification to the Framework Agreement on a Multilateral Nuclear Environmental Programme in the Russian Federation","","22003A0624(02)","","","","http://data.europa.eu/eli/prot/2003/462/oj","Protocol to the agreement","claim, framework agreement, indemnification, nuclear safety, multilateral agreement, nuclear policy, Russia, nuclear accident, protocol to an agreement, judicial proceedings","","External relations, Environment, Nuclear common market","Energy, Environment, consumers and health protection, External relations, Nuclear energy, Environment, Bilateral agreements with non-member countries, Other measures relating to nuclear energy, International cooperation, European countries, Other European countries","","","https://eur-lex.europa.eu/legal-content/AUTO/?uri=CELEX:11957A101, https://eur-lex.europa.eu/legal-content/AUTO/?uri=CELEX:12002E300, https://eur-lex.europa.eu/legal-content/AUTO/?uri=CELEX:12002E181A","","","","ALL_ALL, PUBLISHED_IN_OJ, EU_LAW_ALL, INTER_AGREE","2003-05-21","2007-06-05, 2006-12-08, 2003-06-24, 2004-05-01, 2014-10-14, 2007-01-01","European Community, Denmark, Netherlands, Finland, Russia, Norway, Germany, Sweden, Belgium, France, United Kingdom, European Atomic Energy Community, United States","2003-05-21, 2007-07-26","No end date","","","","true","OJ L 343, 08/12/2006, p. 92–95
		 (ES, DA, DE, EL, EN, FR, IT, NL, PT, FI, SV), This document has been published in a special edition(s) (
           		CS, ET, LV, LT, HU, MT, PL, SK, SL, BG, RO, HR)
		",
"Final Act of the Conference on the European Energy Charter - Annex 3: Energy Charter Protocol on energy efficiency and related environmental aspects","","21994A1231(53)","","","","http://data.europa.eu/eli/prot/1998/181/oj","Protocol to the agreement","European charter, environmental policy, accession to an agreement, EAEC, energy policy, ECSC","","Freedom of establishment, Commercial policy, Taxation, Internal market - Principles, Environment, Provisions under Article 235 EEC, External relations, Energy","Energy, General principles and programmes, General","","","https://eur-lex.europa.eu/legal-content/AUTO/?uri=CELEX:11992E100A, https://eur-lex.europa.eu/legal-content/AUTO/?uri=CELEX:11992E113, https://eur-lex.europa.eu/legal-content/AUTO/?uri=CELEX:11992E057, https://eur-lex.europa.eu/legal-content/AUTO/?uri=CELEX:11992E235, https://eur-lex.europa.eu/legal-content/AUTO/?uri=CELEX:11951K095, https://eur-lex.europa.eu/legal-content/AUTO/?uri=CELEX:11992E073C, https://eur-lex.europa.eu/legal-content/AUTO/?uri=CELEX:11992E099, https://eur-lex.europa.eu/legal-content/AUTO/?uri=CELEX:11992E087, https://eur-lex.europa.eu/legal-content/AUTO/?uri=CELEX:11992E130S, https://eur-lex.europa.eu/legal-content/AUTO/?uri=CELEX:11992E066, https://eur-lex.europa.eu/legal-content/AUTO/?uri=CELEX:11992E054, https://eur-lex.europa.eu/legal-content/AUTO/?uri=CELEX:11957A101, https://eur-lex.europa.eu/legal-content/AUTO/?uri=CELEX:11992E228","","","","ALL_ALL, PUBLISHED_IN_OJ, EU_LAW_ALL, INTER_AGREE","1994-12-17","1994-12-31, 1995-01-01, 2004-05-01, 2012-09-14, 2007-01-01","Lithuania, Portugal, Slovakia, Moldova, Kazakhstan, Sweden, Belgium, France, Cyprus, Ireland, Czechia, European Atomic Energy Community, United Kingdom, Malta, United States, Ukraine, Mongolia, Luxembourg, Georgia, Turkmenistan, Tajikistan, Bulgaria, Croatia, Latvia, Slovenia, Spain, Estonia, North Macedonia, Azerbaijan, European Coal and Steel Community, Greece, Italy, Türkiye, Armenia, Hungary, Australia, Kyrgyzstan, European Community, Romania, Denmark, Liechtenstein, Poland, Germany, Switzerland, Netherlands, Finland, Albania, Austria","1998-04-16","No end date","","","","true","OJ L 380, 31/12/1994, p. 91–112
		 (ES, DA, DE, EL, EN, FR, IT, NL, PT), This document has been published in a special edition(s) (
           		FI, SV, CS, ET, LV, LT, HU, MT, PL, SK, SL, BG, RO, HR)
		",
"Protocol of Agreement on coking coal and coke for the iron and steel industry, reached between the Governments of the Member States of the European Communities at the 107th meeting of the Special Council of Ministers of the ECSC on 16 February 1967 in Luxembourg","/* Unofficial translation */","41967A0228(01)","","","","http://data.europa.eu/eli/prot/1967/228/oj","Protocol to the agreement","aid system, price reduction, coke, iron and steel industry, protocol to an agreement, coal","","Steel industry, Fuels","Energy, Coal, Coal products","","","","","","","ALL_ALL, PUBLISHED_IN_OJ, EU_LAW_ALL, LEGISLATION","1967-02-16","1967-02-28, 1995-01-01","Representatives of the Governments of the Member States","","No end date","","","","true","OJ 36, 28/02/1967, p. 561–561
		 (DE, FR, IT, NL), This document has been published in a special edition(s) (
           		FI, SV)
		",
"Protocol of Agreement on energy problems, reached between the Governments of the Member States of the European Communities at the 94th meeting of the Special Council of Ministers of the European Coal and Steel Community held on 21 April 1964 in Luxembourg","/* Unofficial translation */","41964A0430(01)","","","","http://data.europa.eu/eli/prot/1964/430/oj","Protocol to the agreement","energy production, energy market, energy policy, development plan, protocol to an agreement, energy resources","","Energy","Energy, General principles and programmes, General","","","","","","","ALL_ALL, PUBLISHED_IN_OJ, EU_LAW_ALL, LEGISLATION","1964-04-21","1964-04-30, 1995-01-01","Representatives of the Governments of the Member States","","No end date","","","","true","OJ 69, 30/04/1964, p. 1099–1100
		 (DE, FR, IT, NL), This document has been published in a special edition(s) (
           		FI, SV)
		",
